{
  "manifest_id": "TARGET_A_AFFERENT_ONLY",
  "schema_version": "1.0.0",
  "status": "CAUSAL_TARGET_FROZEN",
  "source_evidence_artifact": "artifacts/steering_asymmetry/plasticity_target_candidate.json",
  "rationale": "Tactile mechanosensory afferents into ascending intermediate neuron AN03A008 (idx 2937). Intact connectome provides only 41 synapses across 8 tactile receptors (vs 78 synapses across 15 receptors on the left homologue). Potentiating these feedforward afferents directly tests rescue of the subthreshold activation bottleneck identified by Lane B.",
  "eligible_populations": [
    {
      "population_name": "tactile_t1_right_receptors",
      "role": "sensory_afferents",
      "neuron_indices": [
        149560,
        154130,
        154675,
        154731,
        154816,
        155200,
        156889,
        159953
      ]
    },
    {
      "population_name": "AN03A008_right",
      "role": "ascending_intermediate",
      "neuron_indices": [
        2937
      ]
    }
  ],
  "eligible_edges": [
    {
      "source": 149560,
      "target": 2937,
      "allowed_direction": "POTENTIATION_ONLY",
      "max_delta_w": 20.0,
      "notes": "Tactile receptor afferent (base weight 13)"
    },
    {
      "source": 154130,
      "target": 2937,
      "allowed_direction": "POTENTIATION_ONLY",
      "max_delta_w": 6.0,
      "notes": "Tactile receptor afferent (base weight 3)"
    },
    {
      "source": 154675,
      "target": 2937,
      "allowed_direction": "POTENTIATION_ONLY",
      "max_delta_w": 8.0,
      "notes": "Tactile receptor afferent (base weight 4)"
    },
    {
      "source": 154731,
      "target": 2937,
      "allowed_direction": "POTENTIATION_ONLY",
      "max_delta_w": 6.0,
      "notes": "Tactile receptor afferent (base weight 3)"
    },
    {
      "source": 154816,
      "target": 2937,
      "allowed_direction": "POTENTIATION_ONLY",
      "max_delta_w": 8.0,
      "notes": "Tactile receptor afferent (base weight 4)"
    },
    {
      "source": 155200,
      "target": 2937,
      "allowed_direction": "POTENTIATION_ONLY",
      "max_delta_w": 8.0,
      "notes": "Tactile receptor afferent (base weight 4)"
    },
    {
      "source": 156889,
      "target": 2937,
      "allowed_direction": "POTENTIATION_ONLY",
      "max_delta_w": 6.0,
      "notes": "Tactile receptor afferent (base weight 3)"
    },
    {
      "source": 159953,
      "target": 2937,
      "allowed_direction": "POTENTIATION_ONLY",
      "max_delta_w": 14.0,
      "notes": "Tactile receptor afferent (base weight 7)"
    }
  ],
  "safety_bounds": {
    "max_total_budget": 60.0,
    "max_edge_delta": 20.0,
    "max_percentage_change": 1.5
  },
  "created_at": "2026-09-19T16:30:00.000Z"
}
